{
  "$schema": "https://json-schema.org/draft/2020-12/schema",
  "$id": "https://github.com/jeongiryang/kg-ontology-decision-framework-reboot/contracts/rule-fact.schema.json",
  "title": "RuleFact",
  "description": "A versioned academic rule with cohort applicability, typed relationships and decisions, evidence, and full human review state.",
  "type": "object",
  "additionalProperties": false,
  "required": ["schema_version", "rule_id", "applicability", "relationship", "decision", "evidence", "review"],
  "properties": {
    "schema_version": { "enum": ["2.0.0", "2.1.0"], "x-current-version": "2.1.0" },
    "rule_id": { "type": "string", "pattern": "^[a-z0-9][a-z0-9._-]{2,127}$" },
    "label": { "type": "string", "minLength": 1 },
    "supersedes_rule_id": { "type": "string", "pattern": "^[a-z0-9][a-z0-9._-]{2,127}$" },
    "applicability": { "$ref": "#/$defs/applicability" },
    "relationship": { "$ref": "#/$defs/relationship" },
    "answer_policy": {
      "type": "string",
      "enum": ["policy_statement", "calculation", "record_only"],
      "description": "Whether this fact may drive a statement, a deterministic calculation, or audit-only storage."
    },
    "decision": {
      "type": "object",
      "additionalProperties": false,
      "required": ["statement", "outcome", "operator"],
      "properties": {
        "statement": { "type": "string", "minLength": 1 },
        "outcome": { "$ref": "#/$defs/outcome" },
        "operator": { "type": "string", "enum": ["all", "any", "threshold", "direct"] }
      }
    },
    "evidence": { "type": "array", "minItems": 1, "items": { "$ref": "#/$defs/evidenceReference" } },
    "review": { "$ref": "#/$defs/review" },
    "review_notes": { "type": "array", "items": { "type": "string", "minLength": 1 } }
  },
  "allOf": [{
    "if": {"properties": {"decision": {"properties": {"outcome": {"properties": {"type": {"const": "operational_policy"}}, "required": ["type"]}}, "required": ["outcome"]}}, "required": ["decision"]},
    "then": {"required": ["answer_policy"], "properties": {"schema_version": {"const": "2.1.0"}, "answer_policy": {"const": "policy_statement"}, "decision": {"properties": {"operator": {"const": "direct"}}}}}
  }],
  "$defs": {
    "yearList": {
      "type": "array",
      "minItems": 1,
      "uniqueItems": true,
      "items": { "type": "integer", "minimum": 1900, "maximum": 2200 }
    },
    "condition": {
      "type": "object",
      "additionalProperties": false,
      "required": ["fact_key", "operator"],
      "properties": {
        "fact_key": { "type": "string", "pattern": "^[a-z][a-z0-9]*(?:[._-][a-z0-9]+)+$" },
        "operator": { "type": "string", "enum": ["equals", "not_equals", "in", "not_in", "at_least", "at_most", "exists"] },
        "value": {}
      },
      "allOf": [
        {
          "if": { "properties": { "operator": { "const": "exists" } }, "required": ["operator"] },
          "then": { "not": { "required": ["value"] } },
          "else": { "required": ["value"] }
        }
      ]
    },
    "applicability": {
      "type": "object",
      "additionalProperties": false,
      "required": ["basis", "departments", "conditions"],
      "properties": {
        "basis": { "type": "string", "enum": ["admission_year", "effective_period", "mixed"] },
        "curriculum_years": { "$ref": "#/$defs/yearList" },
        "admission_years": { "$ref": "#/$defs/yearList" },
        "departments": { "type": "array", "minItems": 1, "uniqueItems": true, "items": { "type": "string", "minLength": 1 } },
        "effective_from": { "type": "string", "format": "date" },
        "effective_to": { "type": "string", "format": "date" },
        "conditions": { "type": "array", "items": { "$ref": "#/$defs/condition" } }
      },
      "allOf": [
        {
          "if": { "properties": { "basis": { "const": "admission_year" } }, "required": ["basis"] },
          "then": { "required": ["curriculum_years", "admission_years"] }
        },
        {
          "if": { "properties": { "basis": { "const": "effective_period" } }, "required": ["basis"] },
          "then": { "required": ["effective_from"] }
        },
        {
          "if": { "properties": { "basis": { "const": "mixed" } }, "required": ["basis"] },
          "then": { "required": ["curriculum_years", "admission_years", "effective_from"] }
        }
      ]
    },
    "relationship": {
      "type": "object",
      "additionalProperties": false,
      "required": ["kind", "target_rule_ids"],
      "properties": {
        "kind": { "type": "string", "enum": ["base", "exception", "override", "supplement"] },
        "target_rule_ids": { "type": "array", "uniqueItems": true, "items": { "type": "string", "pattern": "^[a-z0-9][a-z0-9._-]{2,127}$" } }
      },
      "allOf": [
        {
          "if": { "properties": { "kind": { "const": "base" } }, "required": ["kind"] },
          "then": { "properties": { "target_rule_ids": { "maxItems": 0 } } },
          "else": { "properties": { "target_rule_ids": { "minItems": 1 } } }
        }
      ]
    },
    "outcome": {
      "oneOf": [
        {"$ref": "#/$defs/operationalPolicy"},
        {
          "type": "object",
          "additionalProperties": false,
          "required": ["type", "metric", "comparator", "credits"],
          "properties": {
            "type": { "const": "credit_threshold" },
            "metric": { "type": "string", "pattern": "^[a-z][a-z0-9]*(?:[._-][a-z0-9]+)+$" },
            "comparator": { "const": "at_least" },
            "credits": { "type": "integer", "minimum": 0, "maximum": 500 }
          }
        },
        {
          "type": "object",
          "additionalProperties": false,
          "required": ["type", "requirement", "required"],
          "properties": {
            "type": { "const": "boolean_requirement" },
            "requirement": { "type": "string", "pattern": "^[a-z][a-z0-9]*(?:[._-][a-z0-9]+)+$" },
            "required": { "type": "boolean" }
          }
        },
        {
          "type": "object",
          "additionalProperties": false,
          "required": ["type", "target_requirement", "listing_status"],
          "properties": {
            "type": { "const": "substitution_policy" },
            "target_requirement": { "type": "string", "pattern": "^[a-z][a-z0-9]*(?:[._-][a-z0-9]+)+$" },
            "listing_status": { "type": "string", "enum": ["none_listed", "listed"] },
            "substitute_ids": { "type": "array", "uniqueItems": true, "items": { "type": "string", "minLength": 1 } }
          },
          "allOf": [
            {
              "if": { "properties": { "listing_status": { "const": "listed" } }, "required": ["listing_status"] },
              "then": { "required": ["substitute_ids"], "properties": { "substitute_ids": { "minItems": 1 } } },
              "else": { "properties": { "substitute_ids": { "maxItems": 0 } } }
            }
          ]
        },
        {
          "type": "object",
          "additionalProperties": false,
          "required": ["type", "metric", "maximum_recognized_credits", "excess_counts_toward_graduation"],
          "properties": {
            "type": { "const": "credit_recognition_cap" },
            "metric": { "type": "string", "pattern": "^[a-z][a-z0-9]*(?:[._-][a-z0-9]+)+$" },
            "maximum_recognized_credits": { "type": "integer", "minimum": 0, "maximum": 500 },
            "excess_counts_toward_graduation": { "type": "boolean" }
          }
        },
        {
          "type": "object",
          "additionalProperties": false,
          "required": ["type", "requirement", "coverage_kind", "items", "minimum_items", "minimum_courses_per_item", "one_course_may_cover_multiple_items"],
          "properties": {
            "type": { "const": "coverage_requirement" },
            "requirement": { "type": "string", "pattern": "^[a-z][a-z0-9]*(?:[._-][a-z0-9]+)+$" },
            "coverage_kind": { "enum": ["area", "course_set"] },
            "items": {
              "type": "array", "minItems": 1, "uniqueItems": true,
              "items": { "$ref": "#/$defs/namedItem" }
            },
            "minimum_items": { "type": "integer", "minimum": 1 },
            "minimum_courses_per_item": { "type": "integer", "minimum": 1 },
            "one_course_may_cover_multiple_items": { "type": "boolean" },
            "fixed_credits_per_course": { "type": ["integer", "null"], "minimum": 0, "maximum": 30 }
          }
        },
        {
          "type": "object",
          "additionalProperties": false,
          "required": ["type", "source_metric", "allowed_allocations", "double_counting_allowed"],
          "properties": {
            "type": { "const": "allocation_policy" },
            "source_metric": { "type": "string", "pattern": "^[a-z][a-z0-9]*(?:[._-][a-z0-9]+)+$" },
            "allowed_allocations": { "type": "array", "minItems": 1, "uniqueItems": true, "items": { "type": "string", "minLength": 1 } },
            "double_counting_allowed": { "type": "boolean" }
          }
        },
        {
          "type": "object",
          "additionalProperties": false,
          "required": ["type", "requirement", "credit_value", "required", "result_if_incomplete"],
          "properties": {
            "type": { "const": "completion_requirement" },
            "requirement": { "type": "string", "pattern": "^[a-z][a-z0-9]*(?:[._-][a-z0-9]+)+$" },
            "credit_value": { "type": "integer", "minimum": 0, "maximum": 30 },
            "required": { "type": "boolean" },
            "result_if_incomplete": { "enum": ["fail", "requirement_unsatisfied"] },
            "minimum_completions": { "type": "integer", "minimum": 1 }
          }
        },
        {
          "type": "object",
          "additionalProperties": false,
          "required": ["type", "target_requirement", "eligible_group", "eligibility", "automatic"],
          "properties": {
            "type": { "const": "exception_eligibility" },
            "target_requirement": { "type": "string", "pattern": "^[a-z][a-z0-9]*(?:[._-][a-z0-9]+)+$" },
            "eligible_group": { "type": "string", "pattern": "^[a-z][a-z0-9]*(?:[._-][a-z0-9]+)+$" },
            "eligibility": { "const": "may_be_exempt" },
            "automatic": { "const": false }
          }
        },
        {
          "type": "object",
          "additionalProperties": false,
          "required": ["type", "cohort_kind", "assignment_basis", "completion_year_ignored"],
          "properties": {
            "type": { "const": "cohort_assignment_policy" },
            "cohort_kind": { "enum": ["department_transfer"] },
            "assignment_basis": { "const": "original_admission_year" },
            "completion_year_ignored": { "const": true }
          }
        },
        {
          "type": "object",
          "additionalProperties": false,
          "required": ["type", "scenario", "action", "double_counted", "individual_determination"],
          "properties": {
            "type": { "const": "course_counting_policy" },
            "scenario": { "enum": ["retake", "identical_course_registration", "post_completion_equivalent_or_substitute"] },
            "action": { "enum": ["delete_prior_completion", "registration_blocked", "count_as_separate_courses"] },
            "double_counted": { "type": "boolean" },
            "individual_determination": { "enum": ["not_required", "required_if_retroactive"] }
          }
        },
        {
          "type": "object",
          "additionalProperties": false,
          "required": ["type", "items", "required"],
          "properties": {
            "type": { "const": "recommendation" },
            "items": { "type": "array", "minItems": 1, "uniqueItems": true, "items": { "$ref": "#/$defs/namedItem" } },
            "required": { "const": false }
          }
        }
      ]
    },
    "operationalPolicy": {
      "oneOf": [
        {
          "type": "object", "additionalProperties": false,
          "required": ["type", "kind", "requirement", "minimum_score", "confirmed_as_of", "provisional", "future_guaranteed"],
          "properties": {
            "type": {"const": "operational_policy"}, "kind": {"const": "pccp_current_trial"},
            "requirement": {"const": "coding_test.pccp_current_trial"},
            "minimum_score": {"type": "integer", "minimum": 0, "maximum": 1000},
            "confirmed_as_of": {"type": "string", "format": "date"},
            "provisional": {"const": true}, "future_guaranteed": {"const": false}
          }
        },
        {
          "type": "object", "additionalProperties": false,
          "required": ["type", "kind", "requirement", "capstone_i_result", "capstone_i_enrollment_prohibited", "capstone_ii_enrollment"],
          "properties": {
            "type": {"const": "operational_policy"}, "kind": {"const": "coding_test_failure"},
            "requirement": {"const": "capstone.coding_test_failure"},
            "capstone_i_result": {"const": "U"}, "capstone_i_enrollment_prohibited": {"const": false},
            "capstone_ii_enrollment": {"const": "next_academic_year_not_allowed"}
          }
        },
        {
          "type": "object", "additionalProperties": false,
          "required": ["type", "kind", "requirement", "prerequisite", "sufficient_for_graduation", "automatic_credits"],
          "properties": {
            "type": {"const": "operational_policy"}, "kind": {"const": "graduation_work_prerequisite"},
            "requirement": {"const": "graduation.work.enrollment"}, "prerequisite": {"const": "capstone.ii.pass"},
            "sufficient_for_graduation": {"const": false}, "automatic_credits": {"const": false}
          }
        }
      ]
    },
    "namedItem": {
      "type": "object",
      "additionalProperties": false,
      "required": ["item_id", "label"],
      "properties": {
        "item_id": { "type": "string", "pattern": "^[A-Za-z0-9][A-Za-z0-9._-]{1,63}$" },
        "label": { "type": "string", "minLength": 1 }
      }
    },
    "evidenceReference": {
      "type": "object",
      "additionalProperties": false,
      "required": ["source_id", "locator", "evidence_type"],
      "properties": {
        "source_id": { "type": "string", "minLength": 1 },
        "locator": { "type": "string", "minLength": 1 },
        "evidence_type": { "type": "string", "enum": ["explicit_text", "table_structure", "department_confirmation", "interpretation", "derived_calculation"] },
        "excerpt": { "type": "string", "minLength": 1 }
      }
    },
    "review": {
      "type": "object",
      "additionalProperties": false,
      "required": ["status", "mode", "scope"],
      "properties": {
        "status": { "type": "string", "enum": ["draft", "needs_review", "approved", "rejected"] },
        "mode": { "const": "human" },
        "scope": { "const": "full" },
        "reviewer_id": { "type": "string", "pattern": "^[a-z0-9][a-z0-9._-]{2,127}$" },
        "reviewed_at": { "type": "string", "format": "date-time" },
        "rationale": { "type": "string", "minLength": 1 }
      },
      "allOf": [
        {
          "if": { "properties": { "status": { "enum": ["approved", "rejected"] } }, "required": ["status"] },
          "then": { "required": ["reviewer_id", "reviewed_at", "rationale"] }
        }
      ]
    }
  }
}
