{
  "schema_version": "2.0.0",
  "rule_id": "cwnu.cs.2026.credits.graduation-remaining",
  "label": "졸업 잔여학점",
  "applicability": {"basis": "admission_year", "curriculum_years": [2026], "admission_years": [2026], "departments": ["컴퓨터공학과"], "conditions": []},
  "relationship": {"kind": "base", "target_rule_ids": []},
  "decision": {"statement": "졸업 잔여학점을 18학점 이상 이수해야 한다.", "outcome": {"type": "credit_threshold", "metric": "credits.graduation.remaining", "comparator": "at_least", "credits": 18}, "operator": "threshold"},
  "evidence": [{"source_id": "cwnu.curriculum.2026.changwon-undergraduate", "locator": "PDF p.23 (printed p.15), p.261 (printed p.253), p.577 (printed p.569): 컴퓨터공학과 학점표의 졸업 잔여학점 열", "evidence_type": "table_structure", "excerpt": "졸업 잔여학점 18"}],
  "review": {"status": "approved", "mode": "human", "scope": "full", "reviewer_id": "project_owner", "reviewed_at": "2026-09-18T16:27:06+09:00", "rationale": "프로젝트 책임자가 교육과정 학점표의 졸업 잔여학점 18학점을 확인했다. [question_id=credits.graduation; response_id=response.credits.graduation]"}
}
