{
  "schema_version": "2.0.0",
  "rule_id": "cwnu.cs.2026.major-counseling-completion",
  "label": "0학점 심층상담 이수",
  "applicability": {"basis": "admission_year", "curriculum_years": [2026], "admission_years": [2026], "departments": ["컴퓨터공학과"], "conditions": []},
  "relationship": {"kind": "supplement", "target_rule_ids": ["cwnu.cs.2026.major-required-course-set"]},
  "answer_policy": "policy_statement",
  "decision": {"statement": "심층상담은 0학점이어도 최소 1회 이수해야 하며 매 학기 수강은 권장사항이다.", "outcome": {"type": "completion_requirement", "requirement": "major.counseling.required", "credit_value": 0, "required": true, "result_if_incomplete": "requirement_unsatisfied", "minimum_completions": 1}, "operator": "direct"},
  "evidence": [
    {"source_id": "cwnu.curriculum.2026.changwon-undergraduate", "locator": "PDF p.263 (printed p.255): 컴퓨터공학과 Ⅱ 전공 교과목 편성표, CDA0088 심층상담 행, 이수구분(전공필수)·학점(0) 열", "evidence_type": "table_structure", "excerpt": "CDA0088 심층상담 0학점"},
    {"source_id": "cwnu.curriculum.2026.ta-validation-response", "locator": "PDF p.3, section 4: 심층상담 확인", "evidence_type": "department_confirmation", "excerpt": "0학점이어도 반드시 이수; 1회 이상; 매학기 수강 권장"}
  ],
  "review": {"status": "approved", "mode": "human", "scope": "full", "reviewer_id": "project_owner", "reviewed_at": "2026-09-19T15:39:10+09:00", "rationale": "조교 답변 문서의 심층상담 최소 이수 조건을 승인했다. [question_id=ta.response.acceptance; response_id=response.ta.response.acceptance]"}
}
